{
  "schema_version": "1.0",
  "task": "TASK-705",
  "owner": "kryst@KJ",
  "branch": "agent/TASK-705-decouple-scaffold-report-build-type-from-the-fix",
  "claimed_at": "2026-06-14T23:14:40.130Z",
  "heartbeat_at": "2026-06-14T23:14:40.130Z",
  "expires_at": "2026-06-15T03:14:40.130Z",
  "files_touched_estimate": [
    "contracts/schemas/v1/scaffold-report.schema.json",
    "cli/lib/scaffold.js",
    "tests/appbuilder.test.js"
  ],
  "depends_on": [],
  "overlap_override": null
}
