{
  "schema_version": "1.0",
  "task": "TASK-002",
  "owner": "kryst@KJ",
  "branch": "agent/TASK-002-record-real-test-results-in-handoffs",
  "claimed_at": "2026-06-13T05:30:31.482Z",
  "heartbeat_at": "2026-06-13T05:30:31.482Z",
  "expires_at": "2026-06-13T09:30:31.482Z",
  "files_touched_estimate": [
    "cli/appbuilder.js",
    "tests/appbuilder.test.js",
    "contracts/schemas/v1/handoff.schema.json"
  ],
  "depends_on": [],
  "overlap_override": null
}
