{
  "schema_version": "1.0",
  "task": "TASK-1110",
  "owner": "kryst@KJ",
  "branch": "agent/TASK-1110-latency-accuracy-wiring-and-ephemeral-settings",
  "claimed_at": "2026-06-15T07:56:32.228Z",
  "heartbeat_at": "2026-06-15T07:56:32.228Z",
  "expires_at": "2026-06-15T11:56:32.228Z",
  "files_touched_estimate": [
    "projects/translator-app/src/translator_app/settings.py",
    "projects/translator-app/src/translator_app/app.py",
    "projects/translator-app/tests/test_settings.py"
  ],
  "depends_on": [
    "TASK-1104",
    "TASK-1108"
  ],
  "overlap_override": null
}
