{
  "schema_version": "1.0",
  "task": "TASK-803",
  "owner": "kryst@KJ",
  "branch": "agent/TASK-803-document-the-test-phase-for-operators",
  "claimed_at": "2026-06-15T00:22:43.754Z",
  "heartbeat_at": "2026-06-15T00:22:43.754Z",
  "expires_at": "2026-06-15T04:22:43.754Z",
  "files_touched_estimate": [
    "README.md",
    "HOWTO.md"
  ],
  "depends_on": [
    "TASK-802"
  ],
  "overlap_override": null
}
