{
  "schema_version": "1.0",
  "task": "TASK-1103",
  "owner": "kryst@KJ",
  "branch": "agent/TASK-1103-wasapi-loopback-capture-stream",
  "claimed_at": "2026-06-15T06:51:23.861Z",
  "heartbeat_at": "2026-06-15T06:51:23.861Z",
  "expires_at": "2026-06-15T10:51:23.861Z",
  "files_touched_estimate": [
    "projects/translator-app/src/translator_app/audio/capture.py",
    "projects/translator-app/tests/test_capture.py"
  ],
  "depends_on": [
    "TASK-1102"
  ],
  "overlap_override": null
}
