{
  "schema_version": "1.0",
  "task": "TASK-901",
  "owner": "kryst@KJ",
  "branch": "agent/TASK-901-author-the-review-report-contract-and-validator",
  "claimed_at": "2026-06-15T01:58:51.213Z",
  "heartbeat_at": "2026-06-15T01:58:51.213Z",
  "expires_at": "2026-06-15T05:58:51.213Z",
  "files_touched_estimate": [
    "contracts/schemas/v1/review-report.schema.json",
    "cli/lib/validate.js",
    "cli/appbuilder.js",
    "tests/appbuilder.test.js"
  ],
  "depends_on": [],
  "overlap_override": null
}
