{
  "schema_version": "1.0",
  "task": "TASK-903",
  "owner": "kryst@KJ",
  "branch": "agent/TASK-903-document-the-review-phase-and-drop-start-from-th",
  "claimed_at": "2026-06-15T02:13:02.902Z",
  "heartbeat_at": "2026-06-15T02:13:02.902Z",
  "expires_at": "2026-06-15T06:13:02.902Z",
  "files_touched_estimate": [
    "README.md",
    "HOWTO.md"
  ],
  "depends_on": [
    "TASK-902"
  ],
  "overlap_override": null
}
