{
  "schema_version": "1.0",
  "task": "TASK-501",
  "owner": "kryst@KJ",
  "branch": "agent/TASK-501-add-optional-enum-constrained-build-type-to-requ",
  "claimed_at": "2026-06-14T05:23:01.222Z",
  "heartbeat_at": "2026-06-14T05:23:01.222Z",
  "expires_at": "2026-06-14T09:23:01.222Z",
  "files_touched_estimate": [
    "contracts/schemas/v1/requirements.schema.json",
    "tests/appbuilder.test.js"
  ],
  "depends_on": [],
  "overlap_override": null
}
