{
  "schema_version": "1.0",
  "task": "TASK-001",
  "owner": "kryst@KJ",
  "branch": "agent/TASK-001-guard-expired-claim-reclaim-in-claim-command",
  "claimed_at": "2026-06-13T04:59:14.936Z",
  "heartbeat_at": "2026-06-13T04:59:14.936Z",
  "expires_at": "2026-06-13T08:59:14.936Z",
  "files_touched_estimate": [
    "cli/appbuilder.js",
    "tests/appbuilder.test.js"
  ],
  "depends_on": [],
  "overlap_override": null
}
