{
  "schema_version": "1.0",
  "task": "TASK-1102",
  "owner": "kryst@KJ",
  "branch": "agent/TASK-1102-audio-device-enumeration-and-launch-time-picker",
  "claimed_at": "2026-06-15T06:44:08.391Z",
  "heartbeat_at": "2026-06-15T06:44:08.391Z",
  "expires_at": "2026-06-15T10:44:08.391Z",
  "files_touched_estimate": [
    "projects/translator-app/src/translator_app/audio/devices.py",
    "projects/translator-app/src/translator_app/ui/device_picker.py",
    "projects/translator-app/tests/test_devices.py"
  ],
  "depends_on": [
    "TASK-1101"
  ],
  "overlap_override": null
}
