{
  "schema_version": "1.0",
  "task": "TASK-402",
  "owner": "kryst@KJ",
  "branch": "agent/TASK-402-make-node-test-the-canonical-test-command-on-win",
  "claimed_at": "2026-06-14T01:28:50.743Z",
  "heartbeat_at": "2026-06-14T01:28:50.743Z",
  "expires_at": "2026-06-14T05:28:50.743Z",
  "files_touched_estimate": [
    "HOWTO.md",
    "AGENTS.md"
  ],
  "depends_on": [],
  "overlap_override": null
}
