{
  "schema_version": "1.0",
  "task": "TASK-1106",
  "owner": "kryst@KJ",
  "branch": "agent/TASK-1106-full-screen-transparent-overlay-window",
  "claimed_at": "2026-06-15T07:24:58.520Z",
  "heartbeat_at": "2026-06-15T07:24:58.520Z",
  "expires_at": "2026-06-15T11:24:58.520Z",
  "files_touched_estimate": [
    "projects/translator-app/src/translator_app/ui/overlay_window.py",
    "projects/translator-app/tests/test_overlay_window.py"
  ],
  "depends_on": [
    "TASK-1101"
  ],
  "overlap_override": null
}
